id,user_id,name,description,movies
1,10,Favoritos do João,Filmes que o João mais gosta.,"[{""id"": 1, ""title"": ""O Poderoso Chef\u00e3o"", ""year"": 1972, ""runtime"": 175, ""genre"": ""Crime"", ""description"": ""A saga da fam\u00edlia Corleone."", ""actors"": ""Marlon Brando, Al Pacino"", ""director"": ""Francis Ford Coppola"", ""writer"": ""Mario Puzo"", ""poster_url"": ""url_poster1"", ""backdrop_url"": ""url_backdrop1"", ""trailer_url"": ""url_trailer1"", ""language"": ""en"", ""popularity"": 8.8, ""vote_average"": 9.2, ""streaming_options"": [{""id"": 1, ""name_id"": ""Netflix"", ""url"": ""netflix.com/filme1"", ""price"": 10.0, ""free_trial"": true, ""free_trial_duration"": 7, ""movie_id"": 1}, {""id"": 2, ""name_id"": ""Amazon Prime"", ""url"": ""amazon.com/filme1"", ""price"": 8.0, ""free_trial"": false, ""free_trial_duration"": 0, ""movie_id"": 1}, {""id"": 5, ""name_id"": ""Apple TV"", ""url"": ""appletv.com/filme1"", ""price"": 11.0, ""free_trial"": true, ""free_trial_duration"": 30, ""movie_id"": 1}], ""reviews"": [{""id"": 1, ""movie_id"": 1, ""user_id"": 1, ""rating"": 5.0, ""content"": ""Excelente filme!""}, {""id"": 2, ""movie_id"": 1, ""user_id"": 2, ""rating"": 4.5}]}, {""id"": 2, ""title"": ""Interestelar"", ""year"": 2014, ""runtime"": 169, ""genre"": ""Fic\u00e7\u00e3o Cient\u00edfica"", ""description"": ""Uma equipe de exploradores viaja atrav\u00e9s de um buraco de minhoca."", ""actors"": ""Matthew McConaughey, Anne Hathaway"", ""director"": ""Christopher Nolan"", ""writer"": ""Jonathan Nolan"", ""poster_url"": ""url_poster2"", ""backdrop_url"": ""url_backdrop2"", ""trailer_url"": ""url_trailer2"", ""language"": ""en"", ""popularity"": 8.6, ""vote_average"": 8.6, ""streaming_options"": [{""id"": 3, ""name_id"": ""Disney Plus"", ""url"": ""disneyplus.com/filme2"", ""price"": 12.0, ""free_trial"": true, ""free_trial_duration"": 14, ""movie_id"": 2}], ""reviews"": [{""id"": 3, ""movie_id"": 2, ""user_id"": 3, ""rating"": 2.0, ""content"": ""Mais ou menos...""}]}, {""id"": 3, ""title"": ""A Chegada"", ""year"": 2016, ""runtime"": 116, ""genre"": ""Fic\u00e7\u00e3o Cient\u00edfica"", ""description"": ""Uma linguista \u00e9 recrutada para se comunicar com extraterrestres."", ""actors"": ""Amy Adams, Jeremy Renner"", ""director"": ""Denis Villeneuve"", ""writer"": ""Eric Heisserer"", ""poster_url"": ""url_poster3"", ""backdrop_url"": ""url_backdrop3"", ""trailer_url"": ""url_trailer3"", ""language"": ""pt"", ""popularity"": 7.9, ""vote_average"": 7.7, ""streaming_options"": [{""id"": 4, ""name_id"": ""Hulu"", ""url"": ""hulu.com/filme3"", ""price"": 9.0, ""free_trial"": false, ""free_trial_duration"": 0, ""movie_id"": 3}], ""reviews"": [{""id"": 4, ""movie_id"": 3, ""user_id"": 1, ""rating"": 3.0, ""content"": ""\u00c9 legalzinho.""}]}]"
2,20,Séries da Maria,Séries que a Maria está assistindo.,[]
id,user_id,name,description,movies
,3541,teste,teste,"[{""id"": 666, ""title"": ""Central do Brasil"", ""year"": 1998, ""runtime"": 110, ""genre"": ""Drama"", ""description"": ""Dora escreve cartas para analfabetos na esta\u00e7\u00e3o Central do Brasil. Uma das clientes de Dora \u00e9 Ana, que vem escrever uma carta com o seu filho, Josu\u00e9, um garoto de nove anos, que sonha encontrar o pai que nunca conheceu. Na sa\u00edda da esta\u00e7\u00e3o, Ana \u00e9 atropelada e Josu\u00e9 fica abandonado. Mesmo a contragosto, Dora acaba acolhendo o menino e envolvendo-se com ele. Termina por levar Josu\u00e9 para o interior do Nordeste, \u00e0 procura do pai. \u00c0 medida em que v\u00e3o entrando pa\u00eds adentro, esses dois personagens, t\u00e3o diferentes, v\u00e3o se aproximando... Come\u00e7a ent\u00e3o uma viagem fascinate ao cora\u00e7\u00e3o do Brasil, \u00e0 procura do pai desaparecido, e uma viagem profundamente emotiva ao cora\u00e7\u00e3o de cada um dos personagens do filme."", ""actors"": """", ""director"": """", ""writer"": """", ""poster_url"": ""https://image.tmdb.org/t/p/w500/qfyWFhUhqeNRU9HmCaBDAxVKRZ9.jpg"", ""backdrop_url"": ""https://image.tmdb.org/t/p/w780/lrLIy9OFRQg4VkhrCyolfNXJEUH.jpg"", ""trailer_url"": ""https://www.youtube.com/watch?v=JSWgOhRjJmo"", ""language"": ""pt"", ""popularity"": 12.189, ""vote_average"": 8.1, ""streaming_options"": [], ""reviews"": []}]"
id,user_id,name,description,movies
,56,teste,teste,"[{""id"": 666, ""title"": ""Central do Brasil"", ""year"": 1998, ""runtime"": 110, ""genre"": ""Drama"", ""description"": ""Dora escreve cartas para analfabetos na esta\u00e7\u00e3o Central do Brasil. Uma das clientes de Dora \u00e9 Ana, que vem escrever uma carta com o seu filho, Josu\u00e9, um garoto de nove anos, que sonha encontrar o pai que nunca conheceu. Na sa\u00edda da esta\u00e7\u00e3o, Ana \u00e9 atropelada e Josu\u00e9 fica abandonado. Mesmo a contragosto, Dora acaba acolhendo o menino e envolvendo-se com ele. Termina por levar Josu\u00e9 para o interior do Nordeste, \u00e0 procura do pai. \u00c0 medida em que v\u00e3o entrando pa\u00eds adentro, esses dois personagens, t\u00e3o diferentes, v\u00e3o se aproximando... Come\u00e7a ent\u00e3o uma viagem fascinate ao cora\u00e7\u00e3o do Brasil, \u00e0 procura do pai desaparecido, e uma viagem profundamente emotiva ao cora\u00e7\u00e3o de cada um dos personagens do filme."", ""actors"": """", ""director"": """", ""writer"": """", ""poster_url"": ""https://image.tmdb.org/t/p/w500/qfyWFhUhqeNRU9HmCaBDAxVKRZ9.jpg"", ""backdrop_url"": ""https://image.tmdb.org/t/p/w780/lrLIy9OFRQg4VkhrCyolfNXJEUH.jpg"", ""trailer_url"": ""https://www.youtube.com/watch?v=JSWgOhRjJmo"", ""language"": ""pt"", ""popularity"": 12.079, ""vote_average"": 8.1, ""streaming_options"": [], ""reviews"": []}]"
